{
  "id": "opt-in",
  "term": "opt-in",
  "reading": "オプトイン",
  "category": "IT / Web / Privacy",
  "summary": "本人が事前に同意してから、配信や利用などを開始する方式。",
  "explanation": "ITやWebの文脈では、メール配信・データ利用・通知などについて、利用者が先に『受け取る』『利用を許可する』と明示的に選ぶ方式を指す。opt は『選ぶ』という意味を持ち、opt in は『参加する側を選ぶ』という感覚で使われる。",
  "example": "メールマガジンの申込欄に自分でチェックを入れて登録する。",
  "asked_count": 1,
  "confused_with": ["opt-out"],
  "tags": ["consent", "privacy", "email", "web"],
  "status": "accepted",
  "public": true,
  "created_at": "2026-08-26",
  "updated_at": "2026-08-26"
}
